{
  "id": "vi-g1-english-colours-shapes",
  "kind": "CONTENT_PACK",
  "schema_version": "1.0.0",
  "content_version": "1.0.0",
  "status": "DRAFT",
  "title": "Bé lớp 1 — tiếng Anh: Colours & Shapes (Cambridge Starters)",
  "description": "Gói mẫu BASE_CAMP, English track cấp Starters — chủ đề màu sắc. Chỉ để kiểm chứng kiến trúc, không phải chương trình đầy đủ. Xem docs/CONTENT_ENGLISH_CURRICULUM.md.",
  "locale": "vi-VN",
  "stage": "BASE_CAMP",
  "grades": [1],
  "provenance": {
    "author": "Đội ngũ Hành trình Tự làm được",
    "reviewer": "",
    "source_refs": [{ "label": "Cambridge Young Learners English — Starters wordlist (Colours)", "checked_date": "2026-09-16" }],
    "license": "ORIGINAL_OR_LICENSED"
  },
  "units": [
    {
      "id": "vi-g1-english-colours-shapes-001",
      "schema_version": "1.0.0",
      "content_version": "1.0.0",
      "status": "DRAFT",
      "title": "🌈 Colours & Shapes",
      "locale": "vi-VN",
      "stage": "BASE_CAMP",
      "grades": [1],
      "domains": ["ENGLISH", "COMMUNICATION"],
      "learning_outcomes": [
        {
          "framework": "CAMBRIDGE_YLE",
          "code": "STARTERS_VOCAB_COLOURS",
          "description": "Nhận diện và gọi tên các màu sắc cơ bản bằng tiếng Anh qua đồ vật thật"
        }
      ],
      "skills": [
        { "skill_id": "ENGLISH_VOCABULARY", "role": "PRIMARY" },
        { "skill_id": "ENGLISH_LISTENING", "role": "SECONDARY" },
        { "skill_id": "ORAL_EXPLANATION", "role": "SECONDARY" }
      ],
      "prerequisites": [],
      "duration_minutes": { "screen": 5, "offline": 8 },
      "materials": ["đồ vật hoặc đồ chơi có màu khác nhau trong nhà"],
      "choices": [
        { "id": "OBJECTS", "label": "🧸 Con tìm đồ vật có màu trong nhà" },
        { "id": "CRAYONS", "label": "🖍️ Con dùng bút màu" }
      ],
      "quest_flow": {
        "hook": "Có một quả bóng màu đỏ — a red ball 🔴. Mình cùng học gọi tên màu sắc bằng tiếng Anh nhé!",
        "predict_prompt": "Con đoán xem quả táo 🍎 sẽ gọi màu là 'red' hay 'green' trong tiếng Anh?",
        "plan_prompt": "Con định tìm đồ vật màu gì trước?",
        "attempt_requirement": { "minimum_attempts_before_solution": 1 },
        "explain_prompt": "Con chỉ một đồ vật trong nhà và nói tên màu bằng tiếng Anh cho mình nghe?",
        "revision_prompt": "Con thử tìm thêm một đồ vật màu khác rồi nói tên màu đó bằng tiếng Anh?",
        "reflection_prompt": "Từ màu tiếng Anh nào con thấy dễ nhớ nhất?",
        "attempt_options": [
          { "id": "red", "label": "🔴 red — con tìm được đồ vật màu đỏ" },
          { "id": "yellow", "label": "🟡 yellow — con tìm được đồ vật màu vàng" },
          { "id": "blue", "label": "🔵 blue — con tìm được đồ vật màu xanh dương" },
          { "id": "green", "label": "🟢 green — con tìm được đồ vật màu xanh lá" }
        ]
      },
      "hints": [
        { "level": 1, "type": "REPHRASE", "content": "Mình đang học gọi tên màu sắc bằng tiếng Anh qua đồ vật thật." },
        { "level": 2, "type": "QUESTION", "content": "Con thử nhìn quanh nhà xem có đồ gì màu đỏ không?" },
        { "level": 3, "type": "VISUAL", "content_ref": "approved-visual-ref-colour-flashcards" }
      ],
      "evidence": ["PHOTO_ARTIFACT", "VOICE_EXPLANATION", "PARENT_OBSERVATION", "CHILD_REFLECTION"],
      "rubric_id": "g1-english-vocabulary-v1",
      "adaptations": {
        "easier": ["reduce_to_two_colours", "parent_says_the_colour_first"],
        "harder": ["find_two_objects_per_colour", "name_the_shape_too"],
        "low_confidence": ["practice_with_parent_first"],
        "low_stamina": ["two_colours_now_rest_later"]
      },
      "safety": { "adult_required": false, "risk_level": "LOW" },
      "provenance": {
        "author": "Đội ngũ Hành trình Tự làm được",
        "reviewer": "",
        "source_refs": [],
        "license": "ORIGINAL_OR_LICENSED"
      }
    }
  ]
}
