{
  "id": "vi-g3-english-can-ability",
  "kind": "CONTENT_PACK",
  "schema_version": "1.0.0",
  "content_version": "1.0.0",
  "status": "DRAFT",
  "title": "Explorer lớp 3 — tiếng Anh: I can... (Cambridge Movers)",
  "description": "Gói mẫu EXPLORER, English track cấp Movers — 'can/can't' chỉ khả năng. Chỉ để kiểm chứng kiến trúc, không phải chương trình đầy đủ. Xem docs/CONTENT_ENGLISH_CURRICULUM.md.",
  "locale": "vi-VN",
  "stage": "EXPLORER",
  "grades": [3],
  "provenance": {
    "author": "Đội ngũ Hành trình Tự làm được",
    "reviewer": "",
    "source_refs": [{ "label": "Cambridge Young Learners English — Movers grammar (can/can't for ability)", "checked_date": "2026-09-16" }],
    "license": "ORIGINAL_OR_LICENSED"
  },
  "units": [
    {
      "id": "vi-g3-english-can-ability-001",
      "schema_version": "1.0.0",
      "content_version": "1.0.0",
      "status": "DRAFT",
      "title": "🏊 I can swim",
      "locale": "vi-VN",
      "stage": "EXPLORER",
      "grades": [3],
      "domains": ["ENGLISH", "COMMUNICATION"],
      "learning_outcomes": [
        {
          "framework": "CAMBRIDGE_YLE",
          "code": "MOVERS_SPEAKING_CAN_ABILITY",
          "description": "Nói về khả năng của bản thân bằng cấu trúc 'can/can't'"
        }
      ],
      "skills": [
        { "skill_id": "ENGLISH_SPEAKING", "role": "PRIMARY" },
        { "skill_id": "SOCIAL_CONFIDENCE", "role": "SECONDARY" },
        { "skill_id": "ORAL_EXPLANATION", "role": "SECONDARY" }
      ],
      "prerequisites": [],
      "duration_minutes": { "screen": 6, "offline": 8 },
      "materials": [],
      "choices": [
        { "id": "CAN", "label": "✅ Con nói điều con làm được" },
        { "id": "CANT", "label": "❌ Con nói điều con chưa làm được" }
      ],
      "quest_flow": {
        "hook": "\"I can swim. I can't ride a bike yet.\" 🏊🚲 Mình học nói khả năng của mình bằng 'can/can't'.",
        "predict_prompt": "Con đoán câu phủ định của 'can' viết là gì?",
        "plan_prompt": "Con định nói về việc gì con làm được trước?",
        "attempt_requirement": { "minimum_attempts_before_solution": 1 },
        "explain_prompt": "Con nói cả câu 'I can ___' hoặc 'I can't ___' cho mình nghe?",
        "revision_prompt": "Con thử nói thêm một việc khác con làm được hoặc chưa làm được?",
        "reflection_prompt": "Việc nào con tự hào nhất khi nói 'I can ___'?"
      },
      "hints": [
        { "level": 1, "type": "REPHRASE", "content": "Mình đang nói về những việc mình làm được hoặc chưa làm được bằng tiếng Anh." },
        { "level": 2, "type": "QUESTION", "content": "Con biết bơi không? Vậy câu tiếng Anh sẽ bắt đầu bằng 'I can' hay 'I can't'?" },
        { "level": 3, "type": "STRATEGY_CHOICE", "content": "Con muốn nói việc làm được trước hay việc chưa làm được trước?" }
      ],
      "evidence": ["VOICE_EXPLANATION", "AUDIO_RECORDING", "PARENT_OBSERVATION", "CHILD_REFLECTION"],
      "rubric_id": "g3-english-speaking-v1",
      "adaptations": {
        "easier": ["provide_a_list_of_activities_to_choose_from", "one_sentence_only"],
        "harder": ["ask_a_family_member_can_you_and_report_back", "use_three_activities"],
        "low_confidence": ["practice_with_parent_first"],
        "low_stamina": ["one_sentence_now_rest_later"]
      },
      "safety": { "adult_required": false, "risk_level": "LOW" },
      "provenance": {
        "author": "Đội ngũ Hành trình Tự làm được",
        "reviewer": "",
        "source_refs": [],
        "license": "ORIGINAL_OR_LICENSED"
      }
    }
  ]
}
