{
  "id": "vi-g1-english-family",
  "kind": "CONTENT_PACK",
  "schema_version": "1.0.0",
  "content_version": "1.0.0",
  "status": "DRAFT",
  "title": "Bé lớp 1 — tiếng Anh: My Family (Cambridge Starters)",
  "description": "Gói mẫu BASE_CAMP, English track cấp Starters — chủ đề gia đình. Chỉ để kiểm chứng kiến trúc, không phải chương trình đầy đủ. Xem docs/CONTENT_ENGLISH_CURRICULUM.md.",
  "locale": "vi-VN",
  "stage": "BASE_CAMP",
  "grades": [1],
  "provenance": {
    "author": "Đội ngũ Hành trình Tự làm được",
    "reviewer": "",
    "source_refs": [{ "label": "Cambridge Young Learners English — Starters wordlist (Family)", "checked_date": "2026-09-16" }],
    "license": "ORIGINAL_OR_LICENSED"
  },
  "units": [
    {
      "id": "vi-g1-english-family-001",
      "schema_version": "1.0.0",
      "content_version": "1.0.0",
      "status": "DRAFT",
      "title": "👪 My Family",
      "locale": "vi-VN",
      "stage": "BASE_CAMP",
      "grades": [1],
      "domains": ["ENGLISH", "SOCIAL_EMOTIONAL"],
      "learning_outcomes": [
        {
          "framework": "CAMBRIDGE_YLE",
          "code": "STARTERS_VOCAB_FAMILY",
          "description": "Gọi tên các thành viên trong gia đình bằng tiếng Anh"
        }
      ],
      "skills": [
        { "skill_id": "ENGLISH_VOCABULARY", "role": "PRIMARY" },
        { "skill_id": "ENGLISH_SPEAKING", "role": "SECONDARY" },
        { "skill_id": "ORAL_EXPLANATION", "role": "SECONDARY" }
      ],
      "prerequisites": [],
      "duration_minutes": { "screen": 5, "offline": 6 },
      "materials": ["ảnh gia đình hoặc tranh vẽ người thân (tuỳ chọn)"],
      "choices": [
        { "id": "PHOTO", "label": "📷 Con dùng ảnh gia đình" },
        { "id": "DRAW", "label": "🎨 Con vẽ người thân" }
      ],
      "quest_flow": {
        "hook": "\"This is my mother. This is my father.\" 👪 Mình học gọi tên người thân bằng tiếng Anh.",
        "predict_prompt": "Con đoán 'em gái' trong tiếng Anh là 'sister' hay 'brother'?",
        "plan_prompt": "Con định giới thiệu người nào trong nhà trước?",
        "attempt_requirement": { "minimum_attempts_before_solution": 1 },
        "explain_prompt": "Con chỉ vào ảnh/tranh và nói 'This is my ___' cho từng người?",
        "revision_prompt": "Con thử giới thiệu thêm một người nữa trong nhà được không?",
        "reflection_prompt": "Từ gọi người thân nào bằng tiếng Anh con thấy khó nhớ nhất?",
        "match_pairs": [
          { "id": "mother", "label": "mother", "visual": "mother" },
          { "id": "father", "label": "father", "visual": "father" },
          { "id": "sibling", "label": "sister / brother", "visual": "sibling" },
          { "id": "grandparent", "label": "grandmother / grandfather", "visual": "grandparent" }
        ]
      },
      "hints": [
        { "level": 1, "type": "REPHRASE", "content": "Mình đang học gọi tên người thân trong nhà bằng tiếng Anh." },
        { "level": 2, "type": "QUESTION", "content": "Người đó là nam hay nữ? Trong tiếng Anh, 'mẹ' và 'bố' gọi khác nhau đó." },
        { "level": 3, "type": "VISUAL", "content_ref": "approved-visual-ref-family-flashcards" }
      ],
      "evidence": ["VOICE_EXPLANATION", "PHOTO_ARTIFACT", "PARENT_OBSERVATION", "CHILD_REFLECTION"],
      "rubric_id": "g1-english-vocabulary-v1",
      "adaptations": {
        "easier": ["reduce_to_two_people", "parent_says_the_word_first"],
        "harder": ["introduce_the_whole_family_tree", "add_ages"],
        "low_confidence": ["practice_with_parent_first"],
        "low_stamina": ["two_people_now_rest_later"]
      },
      "safety": { "adult_required": false, "risk_level": "LOW" },
      "provenance": {
        "author": "Đội ngũ Hành trình Tự làm được",
        "reviewer": "",
        "source_refs": [],
        "license": "ORIGINAL_OR_LICENSED"
      }
    }
  ]
}
