{
  "id": "vi-g3-executive-function-homework-start",
  "kind": "CONTENT_PACK",
  "schema_version": "1.0.0",
  "content_version": "1.0.0",
  "status": "DRAFT",
  "title": "Explorer lớp 3 — tự bắt đầu giờ tự học",
  "description": "Gói mẫu stage EXPLORER. Lấp kỹ năng TASK_INITIATION (chưa có unit nào ở EXPLORER). Chỉ để kiểm chứng kiến trúc, không phải chương trình đầy đủ.",
  "locale": "vi-VN",
  "stage": "EXPLORER",
  "grades": [3],
  "provenance": {
    "author": "Đội ngũ Hành trình Tự làm được",
    "reviewer": "",
    "source_refs": [{ "label": "Tự bắt đầu nhiệm vụ ở trẻ tiểu học lớn (task initiation)", "checked_date": "2026-09-14" }],
    "license": "ORIGINAL_OR_LICENSED"
  },
  "units": [
    {
      "id": "vi-g3-task-initiation-homework-start-001",
      "schema_version": "1.0.0",
      "content_version": "1.0.0",
      "status": "DRAFT",
      "title": "📓 Tự mở vở làm bài không cần nhắc",
      "locale": "vi-VN",
      "stage": "EXPLORER",
      "grades": [3],
      "domains": ["EXECUTIVE_FUNCTION", "COMMUNICATION"],
      "learning_outcomes": [
        {
          "framework": "VN_GDPT",
          "code": "CONFIGURABLE_CODE",
          "description": "Tự khởi động giờ tự học mà không cần người lớn nhắc nhở"
        }
      ],
      "skills": [
        { "skill_id": "TASK_INITIATION", "role": "PRIMARY" },
        { "skill_id": "FLEXIBLE_THINKING", "role": "SECONDARY" },
        { "skill_id": "ORAL_EXPLANATION", "role": "SECONDARY" }
      ],
      "prerequisites": [],
      "duration_minutes": { "screen": 3, "offline": 15 },
      "materials": ["vở bài tập", "bút"],
      "choices": [
        { "id": "MATH_HW", "label": "🔢 Con làm bài toán trước" },
        { "id": "WRITING_HW", "label": "✍️ Con làm bài viết trước" }
      ],
      "quest_flow": {
        "hook": "Đến giờ tự học rồi 📓. Không cần ai nhắc, con thử tự mở vở và bắt đầu xem sao.",
        "predict_prompt": "Con nghĩ bài nào trong vở sẽ mất nhiều thời gian nhất?",
        "plan_prompt": "Con định làm bài nào trước, bài nào sau?",
        "attempt_requirement": { "minimum_attempts_before_solution": 1 },
        "explain_prompt": "Điều gì giúp con tự bắt đầu mà không cần ai nhắc?",
        "revision_prompt": "Con thử tự chuyển sang bài tiếp theo mà không cần nghỉ giữa chừng được không?",
        "reflection_prompt": "Lần này con tự bắt đầu nhanh hơn hay chậm hơn mọi khi?"
      },
      "hints": [
        { "level": 1, "type": "REPHRASE", "content": "Mình chỉ cần bắt đầu bằng một bài nhỏ trong vở thôi." },
        { "level": 2, "type": "QUESTION", "content": "Bài nào trong vở làm con thấy dễ bắt đầu nhất?" },
        { "level": 3, "type": "STRATEGY_CHOICE", "content": "Con muốn làm bài dễ trước để lấy đà, hay làm bài khó trước khi còn tỉnh táo?" }
      ],
      "evidence": ["VOICE_EXPLANATION", "PARENT_OBSERVATION", "CHILD_REFLECTION"],
      "rubric_id": "g3-task-initiation-v1",
      "adaptations": {
        "easier": ["parent_sets_out_materials_first", "start_with_favorite_subject"],
        "harder": ["no_reminders_at_all", "self_time_the_start"],
        "low_confidence": ["parent_sits_nearby_silently"],
        "low_stamina": ["one_subject_now_rest_later"]
      },
      "safety": { "adult_required": false, "risk_level": "LOW" },
      "provenance": {
        "author": "Đội ngũ Hành trình Tự làm được",
        "reviewer": "",
        "source_refs": [],
        "license": "ORIGINAL_OR_LICENSED"
      }
    }
  ]
}
