{
  "id": "vi-g3-visual-storytelling-comic",
  "kind": "CONTENT_PACK",
  "schema_version": "1.0.0",
  "content_version": "1.0.0",
  "status": "DRAFT",
  "title": "Explorer lớp 3 — truyện tranh có lời thoại",
  "description": "Gói mẫu stage EXPLORER. Lấp kỹ năng VISUAL_STORYTELLING. Chỉ để kiểm chứng kiến trúc, không phải chương trình đầy đủ.",
  "locale": "vi-VN",
  "stage": "EXPLORER",
  "grades": [3],
  "provenance": {
    "author": "Đội ngũ Hành trình Tự làm được",
    "reviewer": "",
    "source_refs": [{ "label": "Kể chuyện bằng hình có lời thoại (comic strip) cho tiểu học", "checked_date": "2026-09-14" }],
    "license": "ORIGINAL_OR_LICENSED"
  },
  "units": [
    {
      "id": "vi-g3-visual-storytelling-comic-strip-001",
      "schema_version": "1.0.0",
      "content_version": "1.0.0",
      "status": "DRAFT",
      "title": "🎬 Truyện tranh bốn khung có lời thoại",
      "locale": "vi-VN",
      "stage": "EXPLORER",
      "grades": [3],
      "domains": ["ART_DESIGN", "COMMUNICATION"],
      "learning_outcomes": [
        {
          "framework": "VN_GDPT",
          "code": "CONFIGURABLE_CODE",
          "description": "Kể một câu chuyện bằng bốn khung tranh có lời thoại nhân vật"
        }
      ],
      "skills": [
        { "skill_id": "VISUAL_STORYTELLING", "role": "PRIMARY" },
        { "skill_id": "ORAL_EXPLANATION", "role": "SECONDARY" },
        { "skill_id": "REASONING_PLANNING", "role": "SECONDARY" }
      ],
      "prerequisites": [],
      "duration_minutes": { "screen": 6, "offline": 18 },
      "materials": ["giấy chia bốn ô", "bút màu"],
      "choices": [
        { "id": "FAMILIAR", "label": "🐶 Nhân vật quen thuộc (con vật nuôi, bạn bè)" },
        { "id": "INVENTED", "label": "🐉 Nhân vật tưởng tượng" }
      ],
      "quest_flow": {
        "hook": "Một truyện tranh hay có cả hình vẽ và lời thoại 💬. Mình vẽ bốn khung kể một câu chuyện có nhân vật nói chuyện với nhau.",
        "predict_prompt": "Chuyện của con có mấy nhân vật, họ tên gì?",
        "plan_prompt": "Khung nào con định vẽ trước?",
        "attempt_requirement": { "minimum_attempts_before_solution": 1 },
        "explain_prompt": "Lời thoại trong một khung nói gì, và vì sao nhân vật nói câu đó?",
        "revision_prompt": "Con muốn thêm một câu thoại nữa vào khung nào không?",
        "reflection_prompt": "Khung nào con thấy khó nghĩ lời thoại nhất, vì sao?"
      },
      "hints": [
        { "level": 1, "type": "REPHRASE", "content": "Mình đang kể chuyện bằng bốn bức tranh, có nhân vật nói chuyện." },
        { "level": 2, "type": "QUESTION", "content": "Nhân vật của con đang cảm thấy gì ở khung đó? Họ sẽ nói câu gì?" },
        { "level": 3, "type": "STRATEGY_CHOICE", "content": "Con muốn viết lời thoại trước rồi vẽ, hay vẽ trước rồi nghĩ lời thoại?" }
      ],
      "evidence": ["PHOTO_ARTIFACT", "VOICE_EXPLANATION", "PARENT_OBSERVATION", "CHILD_REFLECTION"],
      "rubric_id": "g3-visual-storytelling-v1",
      "adaptations": {
        "easier": ["reduce_to_three_panels", "one_line_of_dialogue_per_panel"],
        "harder": ["add_a_fifth_panel", "add_a_thought_bubble"],
        "low_confidence": ["tell_the_story_aloud_before_drawing"],
        "low_stamina": ["two_panels_now_rest_later"]
      },
      "safety": { "adult_required": false, "risk_level": "LOW" },
      "provenance": {
        "author": "Đội ngũ Hành trình Tự làm được",
        "reviewer": "",
        "source_refs": [],
        "license": "ORIGINAL_OR_LICENSED"
      }
    }
  ]
}
