{
  "id": "vi-g1-english-clothes",
  "kind": "CONTENT_PACK",
  "schema_version": "1.0.0",
  "content_version": "1.0.0",
  "status": "DRAFT",
  "title": "Bé lớp 1 — tiếng Anh: What are you wearing? (Cambridge Starters)",
  "description": "Gói mẫu BASE_CAMP, English track cấp Starters — chủ đề quần áo. Chỉ để kiểm chứng kiến trúc, không phải chương trình đầy đủ. Xem docs/CONTENT_ENGLISH_CURRICULUM.md.",
  "locale": "vi-VN",
  "stage": "BASE_CAMP",
  "grades": [1],
  "provenance": {
    "author": "Đội ngũ Hành trình Tự làm được",
    "reviewer": "",
    "source_refs": [{ "label": "Cambridge Young Learners English — Starters wordlist (Clothes)", "checked_date": "2026-09-16" }],
    "license": "ORIGINAL_OR_LICENSED"
  },
  "units": [
    {
      "id": "vi-g1-english-clothes-001",
      "schema_version": "1.0.0",
      "content_version": "1.0.0",
      "status": "DRAFT",
      "title": "👕 What are you wearing?",
      "locale": "vi-VN",
      "stage": "BASE_CAMP",
      "grades": [1],
      "domains": ["ENGLISH", "COMMUNICATION"],
      "learning_outcomes": [
        {
          "framework": "CAMBRIDGE_YLE",
          "code": "STARTERS_VOCAB_CLOTHES",
          "description": "Gọi tên các món quần áo đang mặc bằng tiếng Anh"
        }
      ],
      "skills": [
        { "skill_id": "ENGLISH_VOCABULARY", "role": "PRIMARY" },
        { "skill_id": "ENGLISH_SPEAKING", "role": "SECONDARY" },
        { "skill_id": "ORAL_EXPLANATION", "role": "SECONDARY" }
      ],
      "prerequisites": [],
      "duration_minutes": { "screen": 4, "offline": 6 },
      "materials": [],
      "choices": [
        { "id": "TODAY", "label": "👕 Con tả quần áo đang mặc" },
        { "id": "FAVOURITE", "label": "👗 Con tả bộ quần áo con thích nhất" }
      ],
      "quest_flow": {
        "hook": "\"I am wearing a red T-shirt.\" 👕 Mình học gọi tên quần áo bằng tiếng Anh.",
        "predict_prompt": "Con đoán 'quần' trong tiếng Anh là 'shirt' hay 'trousers'?",
        "plan_prompt": "Con định tả áo trước hay quần trước?",
        "attempt_requirement": { "minimum_attempts_before_solution": 1 },
        "explain_prompt": "Con nói 'I am wearing ___' cho từng món đồ con đang mặc?",
        "revision_prompt": "Con thử tả thêm một món đồ nữa (giày, mũ...) được không?",
        "reflection_prompt": "Từ quần áo tiếng Anh nào con thấy mới?",
        "attempt_options": [
          { "id": "shirt", "label": "👕 shirt — con tả áo" },
          { "id": "trousers", "label": "👖 trousers — con tả quần" },
          { "id": "shoes", "label": "👟 shoes — con tả giày" },
          { "id": "hat", "label": "🧢 hat — con tả mũ" }
        ]
      },
      "hints": [
        { "level": 1, "type": "REPHRASE", "content": "Mình đang gọi tên quần áo đang mặc bằng tiếng Anh." },
        { "level": 2, "type": "QUESTION", "content": "Món đồ đó mặc ở trên người hay ở chân?" },
        { "level": 3, "type": "VISUAL", "content_ref": "approved-visual-ref-clothes-flashcards" }
      ],
      "evidence": ["VOICE_EXPLANATION", "PHOTO_ARTIFACT", "PARENT_OBSERVATION", "CHILD_REFLECTION"],
      "rubric_id": "g1-english-vocabulary-v1",
      "adaptations": {
        "easier": ["reduce_to_two_items", "parent_says_the_word_first"],
        "harder": ["describe_colour_and_item_together", "describe_a_family_members_clothes"],
        "low_confidence": ["practice_with_parent_first"],
        "low_stamina": ["two_items_now_rest_later"]
      },
      "safety": { "adult_required": false, "risk_level": "LOW" },
      "provenance": {
        "author": "Đội ngũ Hành trình Tự làm được",
        "reviewer": "",
        "source_refs": [],
        "license": "ORIGINAL_OR_LICENSED"
      }
    }
  ]
}
