{
  "id": "vi-g3-reading-fluency-passage",
  "kind": "CONTENT_PACK",
  "schema_version": "1.0.0",
  "content_version": "1.0.0",
  "status": "DRAFT",
  "title": "Explorer lớp 3 — đọc trôi chảy một đoạn văn",
  "description": "Gói mẫu stage EXPLORER. Lấp kỹ năng VIETNAMESE_READING_FLUENCY ở mức EXPLORER (đọc đoạn văn có tốc độ, không chỉ nhận mặt từ). Chỉ để kiểm chứng kiến trúc, không phải chương trình đầy đủ.",
  "locale": "vi-VN",
  "stage": "EXPLORER",
  "grades": [3],
  "provenance": {
    "author": "Đội ngũ Hành trình Tự làm được",
    "reviewer": "",
    "source_refs": [{ "label": "Đọc trôi chảy đoạn văn ngắn ở tiểu học", "checked_date": "2026-09-14" }],
    "license": "ORIGINAL_OR_LICENSED"
  },
  "units": [
    {
      "id": "vi-g3-reading-fluency-passage-001",
      "schema_version": "1.0.0",
      "content_version": "1.0.0",
      "status": "DRAFT",
      "title": "📖 Đọc trôi chảy một đoạn văn ngắn",
      "locale": "vi-VN",
      "stage": "EXPLORER",
      "grades": [3],
      "domains": ["VIETNAMESE_LITERACY", "COMMUNICATION"],
      "learning_outcomes": [
        {
          "framework": "VN_GDPT",
          "code": "CONFIGURABLE_CODE",
          "description": "Đọc trôi chảy, đúng tốc độ một đoạn văn ngắn quen thuộc"
        }
      ],
      "skills": [
        { "skill_id": "VIETNAMESE_READING_FLUENCY", "role": "PRIMARY" },
        { "skill_id": "ORAL_EXPLANATION", "role": "SECONDARY" },
        { "skill_id": "TASK_INITIATION", "role": "SECONDARY" }
      ],
      "prerequisites": [],
      "duration_minutes": { "screen": 5, "offline": 8 },
      "materials": ["đoạn văn ngắn in sẵn hoặc trên màn hình", "đồng hồ hoặc điện thoại bấm giờ"],
      "choices": [
        { "id": "READ_ONCE", "label": "📖 Con đọc một lượt rồi tính giờ" },
        { "id": "READ_TWICE", "label": "🔁 Con đọc thử một lần rồi đọc lại có tính giờ" }
      ],
      "quest_flow": {
        "hook": "Đọc trôi chảy nghĩa là đọc đúng và không bị vấp 📖. Mình thử đọc một đoạn văn ngắn và xem mình đọc mất bao lâu.",
        "predict_prompt": "Con đoán mình sẽ đọc xong đoạn văn trong khoảng bao lâu?",
        "plan_prompt": "Con định đọc thầm trước một lượt hay đọc to luôn?",
        "attempt_requirement": { "minimum_attempts_before_solution": 1 },
        "explain_prompt": "Từ nào trong đoạn văn con thấy khó đọc nhất, vì sao?",
        "revision_prompt": "Con thử đọc lại đoạn văn một lần nữa xem có trôi chảy hơn không?",
        "reflection_prompt": "So với lần đọc trước, lần này con thấy dễ hơn hay khó hơn?"
      },
      "hints": [
        { "level": 1, "type": "REPHRASE", "content": "Mình đang đọc đúng và trôi chảy, không cần đọc thật nhanh." },
        { "level": 2, "type": "QUESTION", "content": "Từ nào làm con phải dừng lại lâu nhất khi đọc?" },
        { "level": 3, "type": "STRATEGY_CHOICE", "content": "Con muốn đọc thầm từ khó đó trước, hay đọc to cả câu chậm lại?" }
      ],
      "evidence": ["VOICE_EXPLANATION", "AUDIO_RECORDING", "PARENT_OBSERVATION", "CHILD_REFLECTION"],
      "rubric_id": "g3-reading-fluency-v1",
      "adaptations": {
        "easier": ["shorten_the_passage", "read_silently_first_no_timing"],
        "harder": ["add_a_second_longer_passage", "read_with_expression"],
        "low_confidence": ["parent_reads_along_quietly"],
        "low_stamina": ["read_half_now_rest_later"]
      },
      "safety": { "adult_required": false, "risk_level": "LOW" },
      "provenance": {
        "author": "Đội ngũ Hành trình Tự làm được",
        "reviewer": "",
        "source_refs": [],
        "license": "ORIGINAL_OR_LICENSED"
      }
    }
  ]
}
